{
  "agent": {
    "harness": "Claude Code general-purpose subagent; live drush on disposable Haven clone; metrics harness-instrumented",
    "model": "claude-opus-4-8",
    "name": "Independent subagent (equipped, live drush)",
    "system_prompt": "",
    "tooling": [
      "shell",
      "drush"
    ]
  },
  "artifacts": {
    "answer_json": "runs/inventory-deleaked-equipped/answer.json",
    "evaluator_json": "runs/inventory-deleaked-equipped/evaluator.json",
    "state_json": "runs/inventory-deleaked-equipped/state.json",
    "transcript": "runs/inventory-deleaked-equipped/transcript.md"
  },
  "evaluator": {
    "failures": [],
    "passed": true,
    "warnings": []
  },
  "failure_labels": [],
  "metrics": {
    "elapsed_seconds": 203.0,
    "human_rescues": 0,
    "tool_calls": 25
  },
  "prompt_version": "v0.2",
  "run_id": "inventory-deleaked-equipped",
  "substrate": {
    "id": "haven-clean-install",
    "run_site_path": "<workspace>/tmp/agent-readiness/inventory-deleaked-equipped/site",
    "source_path": "<workspace>/haven-clean-install"
  },
  "task_id": "inventory.read_only"
}
