{
  "agent": {
    "harness": "fresh Codex subagent with site_architecture aids",
    "model": "gpt-5",
    "name": "Independent Codex subagent",
    "system_prompt": "Default worker prompt plus fixed inventory.read_only enhanced task packet",
    "tooling": [
      "shell",
      "drush",
      "site-architecture"
    ]
  },
  "artifacts": {
    "answer_json": "runs/inventory-enhanced-independent-20260620145648/answer.json",
    "evaluator_json": "runs/inventory-enhanced-independent-20260620145648/evaluator.json",
    "state_json": "runs/inventory-enhanced-independent-20260620145648/state.json",
    "transcript": "runs/inventory-enhanced-independent-20260620145648/transcript.md"
  },
  "evaluator": {
    "failures": [],
    "passed": true,
    "warnings": []
  },
  "failure_labels": [],
  "metrics": {
    "elapsed_seconds": 336.0,
    "human_rescues": 0,
    "tool_calls": 36
  },
  "prompt_version": "v0.1",
  "run_id": "inventory-enhanced-independent-20260620145648",
  "substrate": {
    "id": "haven-clean-install",
    "run_site_path": "<workspace>/tmp/agent-readiness/inventory-enhanced-independent-20260620145648/site",
    "source_path": "<workspace>/haven-clean-install"
  },
  "task_id": "inventory.read_only"
}
